{"convergence":[{"ci95_hi":20.63876143,"ci95_lo":8.18304358,"mean":14.41090251,"n":100,"p_loss":0.31,"sd":31.77537431,"se":3.17753743},{"ci95_hi":12.86043156,"ci95_lo":5.60259966,"mean":9.23151561,"n":300,"p_loss":0.39666667,"sd":32.06929746,"se":1.85152175},{"ci95_hi":12.78639402,"ci95_lo":8.7089335,"mean":10.74766376,"n":1000,"p_loss":0.382,"sd":32.89362053,"se":1.04018761},{"ci95_hi":11.85223606,"ci95_lo":9.54080083,"mean":10.69651845,"n":3000,"p_loss":0.386,"sd":32.29715509,"se":0.58966268},{"ci95_hi":11.99121483,"ci95_lo":10.72527395,"mean":11.35824439,"n":10000,"p_loss":0.3778,"sd":32.2950038,"se":0.32295004},{"ci95_hi":11.40311722,"ci95_lo":10.66800038,"mean":11.0355588,"n":30000,"p_loss":0.3801,"sd":32.48171178,"se":0.18753325},{"ci95_hi":11.15461608,"ci95_lo":10.75217025,"mean":10.95339316,"n":100000,"p_loss":0.38102,"sd":32.46604255,"se":0.10266664}],"environment":{"decisions":{"crn_rule":"Common random numbers: every future draws its five inputs in the fixed order [z_investment (normal), z_revenue (normal), u_growth (uniform), z_margin (normal), u_discount (uniform)] from one xoshiro128** stream, whatever the decision. The decision only transforms the draws afterwards (investment median, revenue multiplier, delay). Future i is therefore the same simulated world under every decision.","lab_ranges":{"delay_years":[0,2],"investment_median":[50.0,150.0],"note":"ranges the LAB may expose; delay_years is an integer; checked only at the three presets","revenue_multiplier":[0.5,1.2]},"presets":[{"id":"build_now","label":"BUILD NOW","median_payback_year":6.195425,"overrides":{"delay_years":0,"investment_median":100.0,"revenue_multiplier":1.0},"paid_back_n":12404,"payback_share_8y":0.6202,"run":{"ci95_hi":11.53552524,"ci95_lo":10.63763461,"mean":11.08657993,"n":20000,"p05":-38.8650565,"p50":9.34480109,"p95":67.1699006,"p_loss":0.3798,"sd":32.39368443,"se":0.22905794,"seed":20261011},"vectors":[{"ci95_hi":11.6969638769,"ci95_lo":5.9275545385,"first_5":[-28.0403156226,15.6946632098,-50.465150621,2.3827039361,-53.7957349082],"mean":8.8122592077,"median_payback_year":6.1985805637,"n":500,"p05":-41.7134915504,"p50":6.1749716428,"p95":63.2683456687,"p_loss":0.408,"payback_share_8y":0.592,"sd":32.9107870664,"se":1.4718151415,"seed":1},{"ci95_hi":13.2843211266,"ci95_lo":10.4560407191,"first_5":[-9.7153828081,47.2428454214,-4.5575468591,37.8086348106,-21.7618594193],"mean":11.8701809228,"median_payback_year":6.1758515006,"n":2000,"p05":-38.3980725641,"p50":10.0099673902,"p95":68.1023656476,"p_loss":0.3755,"payback_share_8y":0.6245,"sd":32.2670584796,"se":0.7215133619,"seed":2},{"ci95_hi":11.827872562,"ci95_lo":9.0002703059,"first_5":[33.476128726,63.1378213463,23.2318708956,6.5482874492,51.8506794164],"mean":10.414071434,"median_payback_year":6.2623417276,"n":2000,"p05":-38.8178662836,"p50":8.0571790558,"p95":66.351907813,"p_loss":0.3815,"payback_share_8y":0.6185,"sd":32.2593216405,"se":0.721340361,"seed":3},{"ci95_hi":11.5092074721,"ci95_lo":9.7066830827,"first_5":[-10.2293769434,-19.3318651834,7.4150057064,-22.8207091498,-12.0333212016],"mean":10.6079452774,"median_payback_year":6.2370870905,"n":5000,"p05":-40.0022073276,"p50":8.9431412821,"p95":66.0693553292,"p_loss":0.3832,"payback_share_8y":0.6168,"sd":32.5153224514,"se":0.4598361,"seed":4},{"ci95_hi":12.786394021,"ci95_lo":8.7089335015,"first_5":[1.9840676814,3.0650290441,-18.3287472178,59.7771872634,16.386607642],"mean":10.7476637613,"median_payback_year":6.222903615,"n":1000,"p05":-40.6234281066,"p50":9.8359215961,"p95":67.2652732932,"p_loss":0.382,"payback_share_8y":0.618,"sd":32.8936205274,"se":1.0401876136,"seed":20261011},{"ci95_hi":11.5246986929,"ci95_lo":9.2410590617,"first_5":[23.3009022999,-50.2091220496,-10.7044008197,2.1817191482,-9.2280305373],"mean":10.3828788773,"median_payback_year":6.207393605,"n":3000,"p05":-38.1038938254,"p50":8.8058446037,"p95":64.3870458684,"p_loss":0.3893333333,"payback_share_8y":0.6106666667,"sd":31.9087735561,"se":0.5825718353,"seed":20261018}],"vs_build_now":{"mean_diff":0.0,"se_diff":0.0,"share_better":0.0}},{"id":"phased","label":"PHASED","median_payback_year":5.959289,"overrides":{"delay_years":0,"investment_median":70.0,"revenue_multiplier":0.75},"paid_back_n":14022,"payback_share_8y":0.7011,"run":{"ci95_hi":13.70590285,"ci95_lo":13.04191258,"mean":13.37390771,"n":20000,"p05":-23.40757115,"p50":11.98431119,"p95":54.9776804,"p_loss":0.2989,"sd":23.95513518,"se":0.16938839,"seed":20261011},"vectors":[{"ci95_hi":13.8165042928,"ci95_lo":9.559362651,"first_5":[-15.2245669898,17.407457162,-32.0760628707,6.9289239593,-33.2284068054],"mean":11.6879334719,"median_payback_year":5.9312217705,"n":500,"p05":-25.134718368,"p50":9.9786022633,"p95":51.8949952774,"p_loss":0.332,"payback_share_8y":0.668,"sd":24.2842679155,"se":1.0860254769,"seed":1},{"ci95_hi":14.9912312751,"ci95_lo":12.9019412743,"first_5":[-2.2959608198,40.049465481,0.7043001028,33.8018097552,-10.3646591082],"mean":13.9465862747,"median_payback_year":5.920071692,"n":2000,"p05":-22.9408904426,"p50":12.5909204699,"p95":56.2866716968,"p_loss":0.288,"payback_share_8y":0.712,"sd":23.8361240479,"se":0.5329919369,"seed":2},{"ci95_hi":13.9324006356,"ci95_lo":11.8418162768,"first_5":[29.2941808687,52.0494147072,22.0846682597,9.7695825303,43.5689099913],"mean":12.8871084562,"median_payback_year":6.0013221886,"n":2000,"p05":-23.5556951138,"p50":11.1005683167,"p95":54.1869606326,"p_loss":0.3015,"payback_share_8y":0.6985,"sd":23.8508910159,"se":0.5333221364,"seed":3},{"ci95_hi":13.7002237058,"ci95_lo":12.3670985241,"first_5":[-2.3627384422,-8.8724241732,10.6696565597,-11.6194674466,-4.3862432663],"mean":13.033661115,"median_payback_year":5.9857065459,"n":5000,"p05":-24.373800442,"p50":11.6108714381,"p95":54.2634515463,"p_loss":0.3014,"payback_share_8y":0.6986,"sd":24.0479382165,"se":0.3400892037,"seed":4},{"ci95_hi":14.6449196408,"ci95_lo":11.6296215502,"first_5":[5.2518588041,7.9307787488,-7.177284204,48.6194012103,17.5900378477],"mean":13.1372705955,"median_payback_year":5.9822575536,"n":1000,"p05":-24.6112911198,"p50":12.4505795583,"p95":55.2262985641,"p_loss":0.303,"payback_share_8y":0.697,"sd":24.3249617488,"se":0.7692228312,"seed":20261011},{"ci95_hi":13.6797065489,"ci95_lo":11.9912965749,"first_5":[21.5064715755,-29.9785635429,-3.1314296041,6.1884053543,-1.5404768764],"mean":12.8355015619,"median_payback_year":5.9852171565,"n":3000,"p05":-22.6555894066,"p50":11.5624740571,"p95":52.9025796679,"p_loss":0.307,"payback_share_8y":0.693,"sd":23.5917658786,"se":0.4307247448,"seed":20261018}],"vs_build_now":{"mean_diff":2.287328,"se_diff":0.059924,"share_better":0.6227}},{"id":"delay_one_year","label":"DELAY ONE YEAR","median_payback_year":6.78289,"overrides":{"delay_years":1,"investment_median":100.0,"revenue_multiplier":1.0},"paid_back_n":9153,"payback_share_8y":0.45765,"run":{"ci95_hi":10.62226645,"ci95_lo":9.80001399,"mean":10.21114022,"n":20000,"p05":-35.36441148,"p50":8.56449143,"p95":61.78542951,"p_loss":0.3798,"sd":29.6648455,"se":0.20976213,"seed":20261011},"vectors":[{"ci95_hi":10.7527029147,"ci95_lo":5.4721194033,"first_5":[-25.603948864,14.1514500325,-45.8529172673,2.1903370483,-50.2116951208],"mean":8.112411159,"median_payback_year":6.6449591019,"n":500,"p05":-38.4771968123,"p50":5.7219548114,"p95":58.9047118531,"p_loss":0.408,"payback_share_8y":0.434,"sd":30.1223486392,"se":1.347112384,"seed":1},{"ci95_hi":12.2241506374,"ci95_lo":9.6347698552,"first_5":[-8.8638379508,43.7854044511,-4.2361129458,34.3047040373,-20.3195855147],"mean":10.9294602463,"median_payback_year":6.7176032215,"n":2000,"p05":-34.9973244371,"p50":9.0960457289,"p95":62.7482984395,"p_loss":0.3755,"payback_share_8y":0.467,"sd":29.5415196112,"se":0.6605684601,"seed":2},{"ci95_hi":10.8795995952,"ci95_lo":8.2920825468,"first_5":[30.0481409043,57.6529455517,21.0899340582,6.0449794369,48.0840761961],"mean":9.585841071,"median_payback_year":6.7874492943,"n":2000,"p05":-35.1907994347,"p50":7.3727321407,"p95":60.7778628701,"p_loss":0.3815,"payback_share_8y":0.446,"sd":29.5202567949,"se":0.6600930091,"seed":3},{"ci95_hi":10.5927014927,"ci95_lo":8.9417756501,"first_5":[-9.3558891629,-17.9854165236,6.7339064611,-20.598730365,-10.8520915096],"mean":9.7672385714,"median_payback_year":6.8195002295,"n":5000,"p05":-36.6520060529,"p50":8.16077934,"p95":60.6257487809,"p_loss":0.3832,"payback_share_8y":0.4566,"sd":29.78067117,"se":0.4211622907,"seed":4},{"ci95_hi":11.7720383897,"ci95_lo":8.0404557956,"first_5":[1.7933379528,2.8304810976,-16.4214854885,54.1945181747,14.9317905163],"mean":9.9062470927,"median_payback_year":6.7651310919,"n":1000,"p05":-36.6473359861,"p50":8.8551236882,"p95":62.264874632,"p_loss":0.382,"payback_share_8y":0.468,"sd":30.1033599789,"se":0.9519518276,"seed":20261011},{"ci95_hi":10.607722316,"ci95_lo":8.5174635783,"first_5":[20.8189446055,-45.3806311191,-9.7200783769,2.0148363288,-8.2910165741],"mean":9.5625929472,"median_payback_year":6.7911756234,"n":3000,"p05":-34.7008045931,"p50":8.0711270725,"p95":59.3415129614,"p_loss":0.3893333333,"payback_share_8y":0.451,"sd":29.2067066206,"se":0.5332390682,"seed":20261018}],"vs_build_now":{"mean_diff":-0.87544,"se_diff":0.01953,"share_better":0.3798}}]},"discount_rate":{"a":0.07,"b":0.12,"dist":"uniform"},"draw_order":["investment (1 normal)","revenue_y1 (1 normal)","growth (1 uniform)","margin (1 normal)","discount_rate (1 uniform)"],"growth":{"a":-0.02,"b":0.15,"dist":"triangular","mode":0.06},"investment":{"dist":"lognormal","mu":4.605170185988092,"sigma":0.15,"unit":"USD M"},"margin":{"dist":"normal","mean":0.35,"sd":0.05},"revenue_y1":{"dist":"normal","mean":48.0,"sd":8.0,"unit":"USD M"},"years":8},"generated_at":"2026-10-11T00:00:00Z","histogram":{"counts":[1,3,3,11,28,64,116,253,416,679,955,1316,1574,1828,1952,1986,1824,1640,1404,1125,826,591,461,339,182,137,120,59,43,24,19,7,4,1,1,2,2,3,0,1],"edges":[-110.0,-102.25,-94.5,-86.75,-79.0,-71.25,-63.5,-55.75,-48.0,-40.25,-32.5,-24.75,-17.0,-9.25,-1.5,6.25,14.0,21.75,29.5,37.25,45.0,52.75,60.5,68.25,